0,project_id,cost,category,votes,name,target,selected
1,705,99000,"environmental protection,public space,urban greenery",1169,Drzewa dla Włoch - edycja trzecia,"children,youth,adults,seniors,people with disabilities",1
2,1832,113000,"environmental protection,public space,urban greenery",956,50 drzew dla Włoch i Okęcia! Więcej nasadzeń,"children,youth,adults,seniors,people with disabilities",1
3,1402,163790,"public transit and roads,public space,urban greenery",794,Zamiana betonowej kostki na zieleń w ciągu ulicy Kleszczowej,None,1
4,1442,234130,"public transit and roads,environmental protection,public space",776,Zielona Aleja - Instalatorów,"children,youth,adults,people with disabilities",1
5,1807,161150,"environmental protection,public space,urban greenery",776,Nasadzenia zieleni przy ul. Dźwigowej.,"children,youth,adults,seniors",1
6,1828,76000,"environmental protection,public space,urban greenery",767,Antysmogowe nasadzenia wzdłuż ul. Świerszcza,"children,youth,adults,seniors",1
7,1702,39000,"education,environmental protection,urban greenery",762,Ratujmy pszczoły- modernizacja społecznej pasieki edukacyjnej Dzielnicy Włochy.,"children,youth,adults,seniors,people with disabilities",1
8,1439,35000,"education,public transit and roads,environmental protection",738,Wieża dla jerzyków na Rakowie,"children,youth,adults,seniors,people with disabilities",1
9,1817,173864,"public transit and roads,public space",710,Chodniki i śmietniki - uzupełniamy brakującą infrastrukturę,"children,youth,adults,seniors",1
10,386,101400,"education,culture",679,Zakup nowości wydawniczych dla bibliotek w Dzielnicy Włochy,"children,youth,adults,seniors,people with disabilities",1
11,401,21000,"environmental protection,public space,urban greenery",661,Łąka kwietna przy Jerozolimskich 204,"children,youth,adults,seniors,people with disabilities",1
12,1438,14455,"education,culture,environmental protection",643,Nakrętkomaty we Włochach,"children,youth,adults,seniors,people with disabilities",1
13,1408,300000,"public space,sport,urban greenery",629,Park dla Okęcia,"children,youth,adults,seniors,people with disabilities",1
14,1563,127100,sport,621,"W zdrowym ciele zdrowy duch - cały rok zajęcia sportowe dla mieszkańców dzielnicy na powietrzu i w salach: callanetics, zdrowy kręgosłup, pilates, joga, gimnastyka dla seniorów, aerobic, boks, aqua fitness, nordic walking, tai chi.","youth,adults,seniors",0
15,1462,249990,"education,culture,welfare",618,Asystent rodzin żyjących z demencją i Alzheimerem we Włochach,"adults,seniors,people with disabilities",0
16,828,142300,"environmental protection,public space,urban greenery",609,Róże w Mieście Ogrodzie Włochy - nasadzenia róż i innych kwitnących krzewów w Starych i Nowych Włochach,"children,youth,adults,seniors,people with disabilities",0
17,1835,160000,"environmental protection,public space,urban greenery",553,"Zielone Włochy! Nasadzenia krzewów w pasach drogowych ul. Obywatelskiej, ul. Kraszewskiego, ul. Piątkowskiej, ul. Szuberta, ul. Rybnickiej, ul. Noteckiej i ul. Michałowskiego.","children,youth,adults",0
18,1591,96000,"culture,public space,urban greenery",549,"Kino letnie w dzielnicy Włochy - boisko przy szkole podstawowej 94 nad Stawami Cietrzewia, boisko w Parku Kotańskiego","adults,seniors,people with disabilities",0
19,1789,11000,"environmental protection,public space",527,Wiewiórka i wróbel - chronimy małych mieszkańców,"children,youth,adults,seniors",1
20,1805,37000,"education,sport,health",509,"Dziewczyny dziewczynom! Warsztaty motywacyjne, asertywność i samoobrona dla kobiet","youth,adults",1
21,1446,5000,"public transit and roads,environmental protection,public space",455,Stojaki rowerowe przy Instalatorów,"children,youth,adults,seniors",1
22,1829,310000,"education,public transit and roads,culture",450,Ratujmy Okęckie zabytki. Uświetnienie terenu Fortu VI - odnowa miejsca pamięci.,"children,youth,adults,seniors,people with disabilities",0
23,1426,76230,"public transit and roads,public space,urban greenery",415,Aranżacja ronda Miasta Ogrodu Włochy,None,0
24,274,55000,"public transit and roads,public space",409,Wybudowanie przejścia dla pieszych przy skrzyżowaniu ul. Globusowej i Nike.,"children,adults,seniors",0
25,1837,38690,"public transit and roads,environmental protection,public space",401,Zieleniec przy ul. Świerszcza,"children,youth,adults,seniors,people with disabilities",0
26,370,271800,"public transit and roads,public space",400,Budowa chodnika przy ul. Krakowiaków,"adults,people with disabilities",0
27,1026,140000,"public transit and roads,environmental protection,public space",399,Radarowe wyświetlacze prędkości we Włochach i na Okęciu,"children,youth,adults,seniors",0
28,1851,210000,public transit and roads,396,Bezpieczny chodnik na ul. Radarowej,"children,youth,adults,seniors,people with disabilities",0
29,1790,50900,"public transit and roads,public space",391,Bezpieczny Kosmos - monitoring w parku Ogrody Kosmosu,"children,youth,adults,seniors",0
30,1024,10000,"public transit and roads,public space",386,Bariera ochronna przy wyjściu z tunelu na ul. Sympatycznej,"children,youth,adults",0
31,1676,86600,"education,culture,urban greenery",377,"Letnie teatrzyki dla najmłodszych w Parku Kotańskiego, w Parku Kombatantów, nad Stawami Cietrzewia, na boisku szkoły podstawowej nr 227 przy Astronautów","children,adults,people with disabilities",0
32,1830,200000,"environmental protection,public space,urban greenery",372,Nowa zieleń na Naukowej. Zagospodarowanie zielenią skweru na Starych Włochach,"children,youth,adults,seniors",0
33,770,40000,"culture,public space",365,Neonowy napis promujący dzielnicę Włochy,"children,youth,adults,seniors,people with disabilities",0
34,421,12800,"education,culture",364,Włochowski Uniwersytet Dziecięcy: bezpłatne twórcze zajęcia dla dzieci,"children,youth",0
35,256,83200,"education,culture,public space",344,Edukacja młodzieży mural - Historia Polskiego Lotnictwa,"children,youth,adults,seniors,people with disabilities",0
36,1653,60000,"education,public transit and roads,public space",320,Poszerzenie chodnika oraz ustawienie barierek przy przejściu dla pieszych na ul. Krańcowej przy wejściu do Parku Stawy Cietrzewia (przy przejściu na ul. Czereśniową),"children,youth,adults,seniors,people with disabilities",0
37,429,20100,culture,316,Zakup gier planszowych i/lub puzzli dla bibliotek,"children,youth,adults,seniors",0
38,1811,300000,"environmental protection,public space,urban greenery",302,Park kieszonkowy przy ul. Emaliowej. Zazieleńmy Niskie Okęcie!,"children,youth,adults,seniors",0
39,1914,110029,education,297,Dwujęzyczny Przedszkolak w dzielnicy Włochy,children,0
40,1826,255000,"education,environmental protection,public space",254,Koniec z potworkiem nad stawem Cietrzewia czyli poprawa estetyki budynku SP nr 94,"children,youth,adults",0
41,2133,58000,sport,246,Piłkochwyt do boiska wielofunkcyjnego,"children,youth,adults,seniors,people with disabilities",0
42,1705,18000,"education,environmental protection,urban greenery",243,Edukacja proekologiczna w społecznej pasiece edukacyjnej Dzielnicy Włochy- lekcje przyrody i festiwal miodobrania.,"children,youth,adults,seniors,people with disabilities",0
43,707,105000,"environmental protection,public space,urban greenery",237,Uporządkowanie pasa zieleni przy ulicy Pola Karolińskie,"children,youth,adults,seniors,people with disabilities",0
44,1781,25000,"education,culture,public space",237,Uliczna biblioteka - bookcrossing Włochy i Okęcie,"children,youth,adults,seniors,people with disabilities",0
45,1233,16000,"education,culture",226,Teatrzyki w bibliotece,children,0
46,321,48000,"public transit and roads,public space,sport",184,Wiata rowerowa przy zajezdni Kleszczowa,"children,youth,adults,seniors",0
47,2121,56000,"education,sport",182,Sobotnie spotkania nad stawem,"children,youth,adults,seniors,people with disabilities",0
48,501,82300,"education,public space,sport",159,Przez zabawę do zdrowia na Malowniczej,"children,youth,people with disabilities",0
49,499,70000,"culture,public space,sport",154,Dosięgamy chmur na Malowniczej,"children,youth,adults,people with disabilities",0
50,1677,33333,"education,public transit and roads,public space",153,Zatrudnienie Pani / Pana „Stopka” na przejściu dla pieszych na ul. Chrościckiego w pobliżu szkoły i kościoła,"children,youth,adults,seniors,people with disabilities",0
51,1164,5000,"education,culture,environmental protection",144,Bawmy się ekologicznie – zakup zabawek przyjaznych środowisku,"children,people with disabilities",1
52,1309,10000,"education,sport",124,Pies z dobrymi manierami - mini piknik integracyjny,"children,youth,adults,seniors",0
53,1490,59000,"education,culture",95,Akademia dobrych manier dla dzieci spotkania - warsztaty,children,0
54,1819,9000,"culture,public space",86,Tablica upamiętniająca Marka Nowakowskiego na ścianie budynku Szkoły Podstawowej nr 94,"children,youth,adults,seniors,people with disabilities",0
